{
  "contract_version": "flyto.robotics.job.v1",
  "job_id": "demo-pharmacy-to-ward-001",
  "robot_id": "flyto-rover-sim-001",
  "task_type": "hospital_delivery",
  "pickup": {
    "station_id": "pharmacy",
    "x": 3.0,
    "y": -2.0,
    "yaw": 1.5708
  },
  "dropoff": {
    "station_id": "ward_a",
    "x": 3.0,
    "y": 2.0,
    "yaw": 1.5708
  },
  "payload": {
    "payload_id": "sealed-bin-001",
    "category": "supplies",
    "sealed": true
  },
  "safety": {
    "max_linear_speed": 0.35,
    "max_angular_speed": 0.8,
    "obstacle_stop_distance": 0.45,
    "pose_tolerance": 0.2,
    "mission_timeout_seconds": 120.0,
    "pickup_dwell_seconds": 1.0,
    "dropoff_dwell_seconds": 1.0
  },
  "metadata": {
    "scenario": "hospital-logistics"
  }
}
